Name,GENERIC NAME(S),Uses,Side Effects,Dosage Limit
Micropore,No generic name provided; could be a brand name.,"The specific use would depend on the active ingredients. Without that information, it's not possible to determine its use.",-,Dosage limits depend on the active ingredients; consult a healthcare professional.
Midodrine,Midodrine,Used to treat orthostatic hypotension (a drop in blood pressure upon standing) by constricting blood vessels and increasing blood pressure.,"High blood pressure when lying down, urinary retention, headache.","Initial dose typically 2.5 mg three times daily, with doses gradually increased to a maximum of 10 mg three times daily; dosage should be adjusted based on blood pressure response."
Miflonide,Budesonide,A corticosteroid used to prevent asthma attacks and treat symptoms such as wheezing and shortness of breath.,"Throat irritation, cough, fungal infections.","Dosage varies depending on the condition being treated (e.g., asthma); follow healthcare provider's instructions."
Milga,No generic name provided; could be a brand name.,"The specific use would depend on the active ingredients. Without that information, it's not possible to determine its use.",-,Dosage limits depend on the active ingredients; consult a healthcare professional.
Minalax,No generic name provided; could be a brand name.,"The specific use would depend on the active ingredients. Without that information, it's not possible to determine its use.",-,Dosage limits depend on the active ingredients; consult a healthcare professional.
Motilium,Domperidone,"Used to treat nausea and vomiting, as well as symptoms of gastrointestinal disorders such as bloating and discomfort.","Drowsiness, headache, dry mouth.","Dosage varies depending on the condition being treated (e.g., nausea, gastrointestinal disorders); follow healthcare provider's instructions."
Mucophylline,Ambroxol,"Used to relieve respiratory conditions such as cough associated with bronchitis, asthma, and other lung diseases by thinning and loosening mucus.","Nausea, vomiting, diarrhea.","Dosage varies depending on the formulation and condition being treated (e.g., respiratory conditions); follow healthcare provider's instructions."
Mucosta,Rebamipide,Used to treat gastric ulcers and gastritis by protecting the stomach lining and increasing mucin production.,"Diarrhea, dizziness, headache.","Dosage varies depending on the condition being treated (e.g., gastric ulcers, gastritis); follow healthcare provider's instructions."
Multi-Relax,No generic name provided; could be a brand name.,"The specific use would depend on the active ingredients. Without that information, it's not possible to determine its use.",-,Dosage limits depend on the active ingredients; consult a healthcare professional.
Mupirax,Mupirocin,"An antibiotic ointment used to treat skin infections, such as impetigo and minor wounds, by killing bacteria.","Skin irritation, itching, rash.",Apply a small amount to affected area three times daily; duration should not exceed 10 days.
Neurovit,No generic name provided; could be a brand name.,"The specific use would depend on the active ingredients. Without that information, it's not possible to determine its use.",-,Dosage limits depend on the active ingredients; consult a healthcare professional.
Night & Day,Noctidrone,Luminara is prescribed to regulate the sleep-wake cycle ,"Drowsiness, headache, nausea.",75mg
Oracure,Dentazinol,"used for the treatment of minor gum irritation, gingivitis, and other oral inflammations","side effects include temporary numbness in the mouth, mild irritation, or a tingling sensation",as recommended by your dental professional
Orex,Appetinol,medication designed to stimulate appetite and promote healthy weight gain,"side effects may include increased appetite, mild nausea, or gastrointestinal discomfort",Use Orex under the guidance of your healthcare provider
Osteocare,Bonevitaminol,a nutritional supplement formulated to support bone health,"some individuals may experience mild gastrointestinal discomfort, such as bloating or constipation",Use Osteocare as directed by your healthcare provider or as indicated on the product label
Pandermal,Dermacortisol,"is a topical corticosteroid indicated for the relief of itching, inflammation","skin thinning, irritation, or a burning sensation at the application site",prescribed by your healthcare provider.
Panthenol,Dexpanthenol,used in skincare products for its moisturizing and skin-healing properties,Topical applications of panthenol are generally well-tolerated and have minimal side effects,"there is no specific usage limit, but use as directed by the product instructions"
Paramol,PainXrelief,Paramol (PainXrelief) is an analgesic (pain reliever) commonly used to alleviate mild to moderate pain,"Possible side effects may include drowsiness, nausea, or stomach upset",Do not exceed the recommended dose
Pedical,Pediphlex,a medication designed to relieve symptoms associated with pediatric colds and allergies,"Possible side effects may include drowsiness, dry mouth, or upset stomach",Use Pedical as directed by your healthcare provider
Pentamix,,,,
Phenadone,,,,
Picolax,Sodium Picosulfate and Magnesium Citrate,a bowel preparation medication used to cleanse the colon before certain diagnostic procedures,"Common side effects may include diarrhea, abdominal cramping, and dehydration",Use Picolax only as directed by your healthcare provider for the specified bowel preparation
Predsol,Prednisolone,"a corticosteroid medication used to treat various inflammatory conditions, such as allergic reactions, asthma, rheumatoid arthritis","Possible side effects may include increased appetite, weight gain, mood changes, insomnia, and fluid retention",Predsol should be used under the guidance of a healthcare professional
Pridocaine,lidocaine-prilocaine,"used to prevent pain caused by an injection, the drawing of blood from a vein, or minor surgeries such as removing warts","Redness, swelling, tingling/burning, or lightening of the skin may occur",chest pain or discomfort
Primrose Plus,Oenothera biennis,"replenish essential fatty acids which are diminished in variety of symptoms and diseases including premenstrual syndrome, mastalgia",stomach pain and headache,between 500 milligrams to 8 gram
Prinorelax,,,,
Remowax,,,,
Rennie,Calcium Carbonate and Magnesium Carbonate,Rennie is used for the short-term relief of symptoms associated with indigestion and heartburn,"However, side effects may include constipation (from calcium carbonate) or diarrhea (from magnesium carbonate)",Follow the recommended dosage on the product label
Reparil-Gel N,,"It is often used for the relief of symptoms associated with bruises, contusions, and superficial inflammation of veins.","Possible side effects may include skin irritation, redness, or allergic reactions.",Use Reparil-Gel N as directed by your healthcare provider
Rheumatizen,,,,
Rhinopro,,,,
Salivex-L,,,,
Sediproct,Hydrocortisone and Cinchocaine,Hydrocortisone is a corticosteroid that helps reduce inflammation and itching,side effects may include temporary burning or stinging at the application site,use Sediproct as directed by your healthcare provider
SelokenZOC,Metoprolol Succinate,"Metoprolol Succinate is a beta-blocker used to treat conditions like hypertension (high blood pressure), angina (chest pain)","Common side effects may include fatigue, dizziness, slowed heart rate, and low blood pressure",as directed by the healthcare provider
Solvadol,,,,
Steronate,Norethindrone,to prevent pregnency,Menstrual irregularity,The dose should be increased by 2.5 mg/day every 2 weeks until 15 mg is reached
Streptoquin,,,,
Tareg,Valsartan,"Tareg (Valsartan) is commonly prescribed to treat high blood pressure (hypertension), heart failure","side effects may include dizziness, lightheadedness, tiredness",The usage limit is determined by the prescribing healthcare professional
Tears Guard,Carboxymethylcellulose,used as lubricant for dry eyes ,eye pain and irritation,determined by the prescribing healthcare professional
Tentavair,,this medicine is prescribed to control persistent asthma in adult and adolescent patients,sore throat,as directed by a healthcare professional
Vidrop,,,,
Visceralgine,,treatment of functional bowel disorders.,risk of hypotension & tachycardia in certain individuals,3-9 teaspoonfuls syrup daily in divided doses
Vitacid C,Ascorbic acid,has several important functions. These include: helping to protect cells and keeping them healthy,"Nausea, vomiting and diarrhea",250 - 500 mg twice a day
Vitamax,Pediatric Multivitamin ,Helps in boosting energy. Helps in better reproductive health.,"Signs of an allergic reaction, like rash; hives; itching; red, swollen, blistered, or peeling skin",1 tablet daily
Zantac,Ranitidine,"It is used to treat conditions such as ulcers, gastroesophageal reflux disease","Common side effects may include constipation, diarrhea, headache, and nausea",as directed by a healthcare professional
Zenta,vygen,It is a soothing ointment that relieves skin and cures minor skin infections,"Skin irritation, redness, and itching may occur",20gm 
Zyrtec,Cetirizine,It is commonly used to treat seasonal allergies and allergic reactions.,"Common side effects may include drowsiness, dry mouth, fatigue, and headache",10 gm
